[
  {
    "id": 201,
    "title": "Event 201: Surprise",
    "description": "This is a major event in your life. Scenario #201 unfolds.",
    "choices": [
      {
        "text": "Go for it!",
        "result": {
          "statChanges": {
            "health": 3,
            "happiness": 2,
            "smarts": 0,
            "looks": 0,
            "money": 2396,
            "reputation": 0
          },
          "nextEventId": 202,
          "unlockAchievementId": null
        }
      },
      {
        "text": "Play it safe.",
        "result": {
          "statChanges": {
            "health": -1,
            "happiness": 0,
            "smarts": 0,
            "looks": 0,
            "money": 450,
            "reputation": 1
          },
          "nextEventId": 203,
          "unlockAchievementId": null
        }
      }
    ]
  },
  {
    "id": 202,
    "title": "Event 202: Crisis",
    "description": "This is a major event in your life. Scenario #202 unfolds.",
    "choices": [
      {
        "text": "Go for it!",
        "result": {
          "statChanges": {
            "health": 4,
            "happiness": 8,
            "smarts": 0,
            "looks": 2,
            "money": 2585,
            "reputation": -3
          },
          "nextEventId": 203,
          "unlockAchievementId": null
        }
      },
      {
        "text": "Play it safe.",
        "result": {
          "statChanges": {
            "health": -1,
            "happiness": -2,
            "smarts": 0,
            "looks": 0,
            "money": 36,
            "reputation": 2
          },
          "nextEventId": 204,
          "unlockAchievementId": null
        }
      }
    ]
  },
  {
    "id": 203,
    "title": "Event 203: Surprise",
    "description": "This is a major event in your life. Scenario #203 unfolds.",
    "choices": [
      {
        "text": "Go for it!",
        "result": {
          "statChanges": {
            "health": -3,
            "happiness": 5,
            "smarts": -1,
            "looks": -1,
            "money": 2647,
            "reputation": 5
          },
          "nextEventId": 204,
          "unlockAchievementId": null
        }
      },
      {
        "text": "Play it safe.",
        "result": {
          "statChanges": {
            "health": 2,
            "happiness": -2,
            "smarts": 0,
            "looks": 0,
            "money": 711,
            "reputation": 0
          },
          "nextEventId": 205,
          "unlockAchievementId": null
        }
      }
    ]
  },
  {
    "id": 204,
    "title": "Event 204: Life Change",
    "description": "This is a major event in your life. Scenario #204 unfolds.",
    "choices": [
      {
        "text": "Go for it!",
        "result": {
          "statChanges": {
            "health": 1,
            "happiness": 5,
            "smarts": 0,
            "looks": 2,
            "money": 2062,
            "reputation": -1
          },
          "nextEventId": 205,
          "unlockAchievementId": null
        }
      },
      {
        "text": "Play it safe.",
        "result": {
          "statChanges": {
            "health": -1,
            "happiness": 1,
            "smarts": 0,
            "looks": 0,
            "money": -409,
            "reputation": -1
          },
          "nextEventId": 206,
          "unlockAchievementId": null
        }
      }
    ]
  },
  {
    "id": 205,
    "title": "Event 205: Big Decision",
    "description": "This is a major event in your life. Scenario #205 unfolds.",
    "choices": [
      {
        "text": "Go for it!",
        "result": {
          "statChanges": {
            "health": -2,
            "happiness": 0,
            "smarts": 4,
            "looks": 1,
            "money": 133,
            "reputation": 5
          },
          "nextEventId": 206,
          "unlockAchievementId": null
        }
      },
      {
        "text": "Play it safe.",
        "result": {
          "statChanges": {
            "health": 1,
            "happiness": 2,
            "smarts": 0,
            "looks": 0,
            "money": 193,
            "reputation": -1
          },
          "nextEventId": 207,
          "unlockAchievementId": null
        }
      }
    ]
  },
  {
    "id": 206,
    "title": "Event 206: Surprise",
    "description": "This is a major event in your life. Scenario #206 unfolds.",
    "choices": [
      {
        "text": "Go for it!",
        "result": {
          "statChanges": {
            "health": -2,
            "happiness": -1,
            "smarts": -1,
            "looks": -1,
            "money": -986,
            "reputation": -2
          },
          "nextEventId": 207,
          "unlockAchievementId": null
        }
      },
      {
        "text": "Play it safe.",
        "result": {
          "statChanges": {
            "health": 2,
            "happiness": 1,
            "smarts": 0,
            "looks": 0,
            "money": 791,
            "reputation": 2
          },
          "nextEventId": 208,
          "unlockAchievementId": null
        }
      }
    ]
  },
  {
    "id": 207,
    "title": "Event 207: Crisis",
    "description": "This is a major event in your life. Scenario #207 unfolds.",
    "choices": [
      {
        "text": "Go for it!",
        "result": {
          "statChanges": {
            "health": -5,
            "happiness": 6,
            "smarts": -2,
            "looks": -1,
            "money": -676,
            "reputation": -3
          },
          "nextEventId": 208,
          "unlockAchievementId": null
        }
      },
      {
        "text": "Play it safe.",
        "result": {
          "statChanges": {
            "health": 1,
            "happiness": 0,
            "smarts": 0,
            "looks": 0,
            "money": 552,
            "reputation": -1
          },
          "nextEventId": 209,
          "unlockAchievementId": null
        }
      }
    ]
  },
  {
    "id": 208,
    "title": "Event 208: Crisis",
    "description": "This is a major event in your life. Scenario #208 unfolds.",
    "choices": [
      {
        "text": "Go for it!",
        "result": {
          "statChanges": {
            "health": -2,
            "happiness": 2,
            "smarts": -1,
            "looks": 1,
            "money": 2818,
            "reputation": 1
          },
          "nextEventId": 209,
          "unlockAchievementId": null
        }
      },
      {
        "text": "Play it safe.",
        "result": {
          "statChanges": {
            "health": -1,
            "happiness": 2,
            "smarts": 0,
            "looks": 0,
            "money": 951,
            "reputation": 0
          },
          "nextEventId": 210,
          "unlockAchievementId": null
        }
      }
    ]
  },
  {
    "id": 209,
    "title": "Event 209: Opportunity",
    "description": "This is a major event in your life. Scenario #209 unfolds.",
    "choices": [
      {
        "text": "Go for it!",
        "result": {
          "statChanges": {
            "health": 5,
            "happiness": 8,
            "smarts": 4,
            "looks": 1,
            "money": 849,
            "reputation": -1
          },
          "nextEventId": 210,
          "unlockAchievementId": null
        }
      },
      {
        "text": "Play it safe.",
        "result": {
          "statChanges": {
            "health": 1,
            "happiness": -2,
            "smarts": 0,
            "looks": 0,
            "money": -247,
            "reputation": -1
          },
          "nextEventId": 211,
          "unlockAchievementId": null
        }
      }
    ]
  },
  {
    "id": 210,
    "title": "Event 210: Life Change",
    "description": "This is a major event in your life. Scenario #210 unfolds.",
    "choices": [
      {
        "text": "Go for it!",
        "result": {
          "statChanges": {
            "health": -4,
            "happiness": 2,
            "smarts": 4,
            "looks": 1,
            "money": -378,
            "reputation": 4
          },
          "nextEventId": 211,
          "unlockAchievementId": null
        }
      },
      {
        "text": "Play it safe.",
        "result": {
          "statChanges": {
            "health": 0,
            "happiness": 0,
            "smarts": 0,
            "looks": 0,
            "money": 530,
            "reputation": 0
          },
          "nextEventId": 212,
          "unlockAchievementId": null
        }
      }
    ]
  },
  {
    "id": 211,
    "title": "Event 211: Big Decision",
    "description": "This is a major event in your life. Scenario #211 unfolds.",
    "choices": [
      {
        "text": "Go for it!",
        "result": {
          "statChanges": {
            "health": -4,
            "happiness": 4,
            "smarts": 0,
            "looks": 0,
            "money": 2827,
            "reputation": 3
          },
          "nextEventId": 212,
          "unlockAchievementId": null
        }
      },
      {
        "text": "Play it safe.",
        "result": {
          "statChanges": {
            "health": -1,
            "happiness": 1,
            "smarts": 0,
            "looks": 0,
            "money": 331,
            "reputation": 2
          },
          "nextEventId": 213,
          "unlockAchievementId": null
        }
      }
    ]
  },
  {
    "id": 212,
    "title": "Event 212: Life Change",
    "description": "This is a major event in your life. Scenario #212 unfolds.",
    "choices": [
      {
        "text": "Go for it!",
        "result": {
          "statChanges": {
            "health": -2,
            "happiness": 5,
            "smarts": 2,
            "looks": -2,
            "money": 2754,
            "reputation": 1
          },
          "nextEventId": 213,
          "unlockAchievementId": null
        }
      },
      {
        "text": "Play it safe.",
        "result": {
          "statChanges": {
            "health": 1,